### ISSUE TITLE
Mqtt bridge over quic cannot handle large size data

### ISSUE THREAD

**Issue by rty813** [nanomq/nanomq#1920]
**Describe the bug**
I am using nanomq arm64 version on nvidia jetson orin board. And configured quic bridge. When the length of data sent is less than one thousand, it is normal. When the length of data exceeds a certain threshold, no data is sent out through quic (tcpdump can not capture any UDP data packets). And after a while, nanomq reports `Shutdown on CONNECTION_TIMEOUT` error, and then automatically reconnects.

This threshold is probably between 1200 and 1400

If I change to tcp bridge, everything is normal.

**Environment Details**
 - NanoMQ version
   0.22.8
 - Operating system and version
   Ubuntu20.04, arm64, Jetpack R35.3.1

**Additional context**
The system has two network interfaces, one is `usb0` and the other is `eth0`. This problem occurs when usb0 is used as the default gateway. If eth0 is used as the default gateway, everything works fine. The following is the specific information of the two network interfaces:
```
3: eth0: <BROADCAST,MULTICAST,UP,LOWER_UP> mtu 1500 qdisc pfifo_fast state UP mode DEFAULT group default qlen 1000
    link/ether 48:b0:2d:d8:ca:f9 brd ff:ff:ff:ff:ff:ff promiscuity 0 minmtu 68 maxmtu 9194 addrgenmode none numtxqueues 1 numrxqueues 1 gso_max_size 64000 gso_max_segs 64 
    RX: bytes  packets  errors  dropped overrun mcast   
    158G       136M     0       0       0       4.84M   
    TX: bytes  packets  errors  dropped carrier collsns 
    18.4G      39.3M    0       0       0       0       
    altname enP8p1s0

4: usb0: <NOARP,UP,LOWER_UP> mtu 1500 qdisc pfifo_fast state UNKNOWN mode DEFAULT group default qlen 1000
    link/ether 5e:bb:43:7e:67:91 brd ff:ff:ff:ff:ff:ff promiscuity 0 minmtu 0 maxmtu 65535 addrgenmode eui64 numtxqueues 1 numrxqueues 1 gso_max_size 65536 gso_max_segs 65535 
    RX: bytes  packets  errors  dropped overrun mcast   
    80.8M      691k     0       0       0       0       
    TX: bytes  packets  errors  dropped carrier collsns 
    254M       681k     0       0       0       0       
```
I think it may be related to the system's network configuration, but I have no idea.

[log.txt](https://github.com/user-attachments/files/17376951/log.txt)

**Comment by JaylinYu** [comment]
0x63 connection timeout means `The connection timed out waiting for a response from the peer.` 
You probably hitting the max MTU limitation of network interface.

**Comment by rty813** [comment]
Can it not be sent after reaching the maximum MTU? Then why can't even the heartbeat be maintained, resulting in a connection interruption?

**Comment by JaylinYu** [comment]
This is done by QUIC library, unfortunately, MTU limitation is a well know issue for quic adopters.

**Comment by rty813** [comment]
As far as I know, all QUIC packets should be the same size, and padding will be used when they are not enough. So if the size of the data sent exceeds the MTU, won't the handshake fail at the beginning?

**Comment by rty813** [comment]
I found that when sending large data MQTT packets, there is a probability that a few packets can be sent successfully. But it is very occasional and there is no pattern. If it exceeds the MTU limit, should all packets fail to be sent?
![image](https://github.com/user-attachments/assets/a68a4d9c-4a58-4530-ae05-eb3b66a65580)

When the packet is sent successfully, tcpdump captures the log：
```
# tcpdump -s0 -p -ni usb0 udp port 14567
tcpdump: verbose output suppressed, use -v or -vv for full protocol decode
listening on usb0, link-type EN10MB (Ethernet), capture size 262144 bytes
10:02:21.404684 IP xxx.xxx.xxx.xxx.14567 > 10.76.81.191.38553: UDP, length 1412
10:02:22.708688 IP xxx.xxx.xxx.xxx.14567 > 10.76.81.191.38553: UDP, length 24
10:02:26.650644 IP 10.76.81.191.45714 > xxx.xxx.xxx.xxx.14567: UDP, length 1332
10:02:26.745938 IP xxx.xxx.xxx.xxx.14567 > 10.76.81.191.45714: UDP, length 30
10:02:26.747184 IP 10.76.81.191.45714 > xxx.xxx.xxx.xxx.14567: UDP, length 1332
10:02:26.748302 IP 10.76.81.191.45714 > xxx.xxx.xxx.xxx.14567: UDP, length 1332
10:02:26.838708 IP xxx.xxx.xxx.xxx.14567 > 10.76.81.191.45714: UDP, length 37
10:02:26.839982 IP 10.76.81.191.45714 > xxx.xxx.xxx.xxx.14567: UDP, length 1332
10:02:26.939781 IP xxx.xxx.xxx.xxx.14567 > 10.76.81.191.45714: UDP, length 28
10:02:26.945224 IP 10.76.81.191.45714 > xxx.xxx.xxx.xxx.14567: UDP, length 523
10:02:26.956506 IP 10.76.81.191.45714 > xxx.xxx.xxx.xxx.14567: UDP, length 1332
10:02:26.957670 IP 10.76.81.191.45714 > xxx.xxx.xxx.xxx.14567: UDP, length 483
10:02:27.054931 IP xxx.xxx.xxx.xxx.14567 > 10.76.81.191.45714: UDP, length 37
10:02:27.155389 IP 10.76.81.191.45714 > xxx.xxx.xxx.xxx.14567: UDP, length 36
10:02:27.823478 IP 10.76.81.191.45714 > xxx.xxx.xxx.xxx.14567: UDP, length 66
10:02:27.909703 IP xxx.xxx.xxx.xxx.14567 > 10.76.81.191.45714: UDP, length 28
10:02:27.911043 IP 10.76.81.191.45714 > xxx.xxx.xxx.xxx.14567: UDP, length 1332
10:02:27.933403 IP 10.76.81.191.45714 > xxx.xxx.xxx.xxx.14567: UDP, length 1332
10:02:28.028070 IP xxx.xxx.xxx.xxx.14567 > 10.76.81.191.45714: UDP, length 27
10:02:28.029336 IP 10.76.81.191.45714 > xxx.xxx.xxx.xxx.14567: UDP, length 120
10:02:28.053669 IP xxx.xxx.xxx.xxx.14567 > 10.76.81.191.45714: UDP, length 27
10:02:28.139660 IP xxx.xxx.xxx.xxx.14567 > 10.76.81.191.45714: UDP, length 27
```

**Comment by qzhuyan** [comment]
@rty813 I don't know nanomq, but from EMQX perspective, pls first check if handshake is successful or not.
if handshake success, MTU shouldn't not be a problem unless network path changes. 

After handshake success you should able to send large application payload as it is reliable streaming transport. 

Tcpdump trace on the usb network interface  will be helpful for investigation regarding the handshakes.  

another idea worth for trying is check the some feature on your usb device such as GSO because you have two network interfaces, the quic stack (some old version) may fail to detect the features. ref: https://github.com/microsoft/msquic/issues/3865

**Comment by rty813** [comment]
@qzhuyan The handshake was successful because I gradually increased the amount of data from small to large. Everything was normal at the beginning, but when the packet size reached a certain threshold, an abnormality occurred. If the handshake failed, the small data packet should not have been sent out at the beginning.

**Comment by rty813** [comment]
I tend to think it is an internal problem of nanomq, because if it is a problem with quic, nanomq should never be able to send out data packets, but in fact it can be sent out occasionally.

**Comment by JaylinYu** [comment]
If nano is the one to be blamed, then why it works fine on another interface?
Also We have other Customer test on large video files via quic.
 There is really no much to do from nanomq' perspective. No limitation about  packet size, only one form mqttv5.

**Comment by qzhuyan** [comment]
Just in case when you run out of ideas, I would suggest to try https://github.com/emqx/emqtt-bench with large payload via your usb interface. 

If emqtt bench doesn't work as well,  I could help to investigate.

publisher:
```
# one publisher, pub 1msg/s to topic `test`,  payload size 1400bytes.
./emqtt_bench pub --quic true -p 14567 -c 1 -p 1400 -t test -h BROKER_HOSTNAME
```

subscriber:
```
# one tcp subscriber verify the receiving.
./emqtt_bench sub -t test -c 1 -h BROKER_HOSTNAME
```

**Comment by rty813** [comment]
@qzhuyan emqtt bench result:
```
 ./emqtt_bench pub --quic true -p 14567 -c 1 -s 2000 -t test -h xxxxxxxxxxx
Start with 1 workers, addrs pool size: 1 and req interval: 10 ms 

2s pub total=1 rate=0.50/sec
2s connect_succ total=1 rate=0.50/sec
3s pub total=2 rate=1.00/sec
4s pub total=3 rate=1.00/sec
5s pub total=4 rate=1.00/sec
6s pub total=5 rate=1.00/sec
7s pub total=6 rate=1.00/sec
8s pub total=7 rate=1.00/sec
9s pub total=8 rate=1.00/sec
10s pub total=9 rate=1.00/sec
11s pub total=10 rate=1.00/sec
12s pub total=11 rate=1.00/sec
13s pub total=12 rate=1.00/sec
14s pub total=13 rate=1.00/sec
15s pub total=14 rate=1.00/sec
16s pub total=15 rate=1.00/sec
17s pub total=16 rate=1.00/sec
18s pub total=17 rate=1.00/sec
19s pub total=18 rate=1.00/sec
20s pub total=19 rate=1.00/sec
```

```
./emqtt_bench sub -t test -c 1 -h xxxxxxxxxx -p 11883
Start with 1 workers, addrs pool size: 1 and req interval: 10 ms 

1s sub total=1 rate=1.00/sec
1s connect_succ total=1 rate=1.00/sec
5s recv total=1 rate=0.20/sec
6s recv total=2 rate=1.00/sec
7s recv total=3 rate=1.00/sec
8s recv total=4 rate=1.00/sec
9s recv total=5 rate=1.00/sec
10s recv total=6 rate=1.00/sec
11s recv total=7 rate=1.00/sec
12s recv total=8 rate=1.00/sec
13s recv total=9 rate=1.00/sec
14s recv total=10 rate=1.00/sec
15s recv total=11 rate=1.00/sec
16s recv total=12 rate=1.00/sec
17s recv total=13 rate=1.00/sec
18s recv total=14 rate=1.00/sec
19s recv total=15 rate=1.00/sec
20s recv total=16 rate=1.00/sec
21s recv total=17 rate=1.00/sec
22s recv total=18 rate=1.00/sec
23s recv total=19 rate=1.00/sec
```

The same network interface 'usb0' is used for emqtt_bench and nanomq tests

**Comment by rty813** [comment]
> If nano is the one to be blamed, then why it works fine on another interface? Also We have other Customer test on large video files via quic. There is really no much to do from nanomq' perspective. No limitation about packet size, only one form mqttv5.

I just suspect that when nanomq was using quic communication, it happened to encounter some special features of the usb0 network interfaces, causing an exception

**Comment by rty813** [comment]
@JaylinYu Everything is normal in version 0.22.10, and this problem does not occur

**Comment by JaylinYu** [comment]
Interesting.... 
But 0.22.10 is a version with multi-stream on by default, not sure if this makes any difference. Despite that, the sending part has no changes...

**Comment by rty813** [comment]
Can I close multi-stream feature from configuration file?

**Comment by JaylinYu** [comment]
Not possible in 0.22.10. Will be possible in next formal ver

**Comment by rty813** [comment]
Ok, I will retest then.

**Comment by JaylinYu** [comment]
Still not expose the multi-stream switch yet...
